{
  "kind": "seevee.presentation",
  "schemaVersion": "1.0.0",
  "id": "pres_demo",
  "revision": 0,
  "createdAt": "2026-09-23T00:00:00.000Z",
  "updatedAt": "2026-09-23T00:00:00.000Z",
  "data": {
    "cvId": "cv_demo",
    "template": {
      "templateId": "tpl_minimal",
      "versionId": "tplv_minimal_1",
      "stylePresetId": null
    },
    "page": {
      "preset": "A4",
      "orientation": "portrait",
      "widthMm": 210,
      "heightMm": 297,
      "marginMm": {
        "top": 12,
        "right": 12,
        "bottom": 12,
        "left": 12
      },
      "bleedMm": 0
    },
    "pagination": {
      "targetPages": 1,
      "maxPages": 2,
      "overflowPolicy": "error"
    },
    "tokens": {
      "core": {
        "fontFamily": "Inter",
        "baseFontSizePt": 9.5,
        "lineHeight": 1.3,
        "density": 1,
        "primaryColor": "#111111",
        "accentColor": "#2457d6",
        "columnGapMm": 7
      },
      "template": {}
    },
    "sectionOverrides": {},
    "templateOverrides": {},
    "extensions": {}
  }
}
